cluster,ID,title,author,dblp_key,url,number,volume,year,journal,ENTRYTYPE,doi,__orig_index
1,000306,Special Section - Information Technology and Organization Design,"Baroudi, Jack J. and Lucas Jr., Henry C.",https://dblp.org/rec/journals/jmis/BaroudiL94,http://www.jmis-web.org/articles/69,4,10,1994,Journal of Management Information Systems,article,,305
1,000308,The Role of Information Technology in Organization Design,"Lucas Jr., Henry C. and Baroudi, Jack J.",https://dblp.org/rec/journals/jmis/LucasB94,http://www.jmis-web.org/articles/642,4,10,1994,Journal of Management Information Systems,article,,307
2,000914,Special Issue - Trust in Online Environments,"Benbasat, Izak and Gefen, David and Pavlou, Paul A.",https://dblp.org/rec/journals/jmis/BenbasatGP08,http://www.jmis-web.org/articles/86,4,24,2008,Journal of Management Information Systems,article,,913
2,000920,A Research Agenda for Trust in Online Environments,"Gefen, David and Benbasat, Izak and Pavlou, Paul A.",https://dblp.org/rec/journals/jmis/GefenBP08,http://www.jmis-web.org/articles/357,4,24,2008,Journal of Management Information Systems,article,,919
3,001161,Special Issue - Neuroscience in Information Systems Research,"Liang, Ting-Peng and vomBrocke, Jan",https://dblp.org/rec/journals/jmis/Liangv14,http://www.jmis-web.org/articles/1175,4,30,2014,Journal of Management Information Systems,article,,1160
3,001165,Guidelines for Neuroscience Studies in Information Systems Research,"vomBrocke, Jan and Liang, Ting-Peng",https://dblp.org/rec/journals/jmis/vomBrockeL14,http://www.jmis-web.org/articles/1170,4,30,2014,Journal of Management Information Systems,article,,1164
