"ID","title","year","author","pages","volume","number","ENTRYTYPE","journal"
"id_0000926","""Cause-Specific Hospital Admissions on Hot Days in Sydney, Australia""",2013,"Vaneckova, P. and Bambrick, H.",,8,143,"article","PLoS ONE"
"id_0000927","Tofacitinib or adalimumab versus placebo in rheumatoid arthritis",2012,"Van Vollenhoven, R. F. and Fleischmann, R. and Cohen, S. and Lee, E. B. and Meijide, J. A. G. and Wagner, S. and Forejtova, S. and Zwillich, S. H. and Gruben, D. and Koncz, T. and Wallenstein, G. V. and Krishnaswami, S. and Bradley, J. D. and Wilkinson, B.","508-519",367,1845,"article","New England Journal of Medicine"
"id_0000928","Trimodality therapy for malignant pleural mesothelioma: Results from an EORTC phase II multicentre trial",2010,"Van Schil, P. E. and Baas, P. and Gaafar, R. and Maat, A. P. and Van De Pol, M. and Hasane, B. and Klomp, H. M. and Abdelrahman, A. M. and Welche, J. and Van Meerbeeck, J. P.","1362-1369",36,1900,"article","European Respiratory Journal"
"id_0000929","Phase I clinical and pharmacologic trial of carboplatin daily for 5 days",1984,"Van Echo, D. A. and Egorin, M. J. and Whitacre, M. Y. and Olman, E. A. and Aisner, J.","1103-1114",68,1144,"article","Cancer Treatment Reports"
"id_0000930","Mature results of a phase II trial on individualised accelerated radiotherapy based on normal tissue constraints in concurrent chemo-radiation for stage III non-small cell lung cancer",2012,"Van Baardwijk, A. and Reymen, B. and Wanders, S. and Borger, J. and Ollers, M. and Dingemans, A. M. C. and Bootsma, G. and Geraedts, W. and Pitz, C. and Lunde, R. and Peters, F. and Lambin, P. and Ruysscher, D. D.","2339-2346",48,951,"article","European Journal of Cancer"
"id_0000931","Mature results of a Phase II trial on individualized radiation dose-escalation based on normal tissue constraints in concurrent chemo-radiation for stage III non-small cell lung cancer (NSCLC)",2011,"Van Baardwijk, A. and Reymen, B. and Wanders, R. and Dingemans, A. C. and Bootsma, G. and Pitz, C. and Lunde, R. and Geraedts, W. and Lambin, P. and De Ruysscher, D.","S133-S134",81,952,"article","International Journal of Radiation Oncology Biology Physics"
"id_0000932","""Phase II trial of docetaxel: a new, highly effective antineoplastic agent in the management of patients with anthracycline-resistant metastatic breast cancer""",1995,"Valero, V. and Holmes, F. A. and Walters, R. S. and Theriault, R. L. and Esparza, L. and Fraschini, G. and Fonseca, G. A. and Bellet, R. E. and Buzdar, A. U. and Hortobagyi, G. N.","2886-2894",13,1231,"article","Journal of Clinical Oncology"
"id_0000933","Clinical evaluation of closed suction drainage following hepatectomy",1997,"Uetsuji, S. and Kwon, A. H. and Komada, H. and Okuda, Y. and Imamura, A. and Kamiyama, Y.","298-301",27,189,"article","Surgery Today"
"id_0000934","Prevention of pleural effusion after hepatectomy using fibrin sealant",1994,"Uetsuji, S. and Komada, Y. and Kwon, A. H. and Imamura, A. and Takai, S. and Kamiyama, Y.","135-137",79,1402,"article","International Surgery"
"id_0000935","Safety and efficacy of early postoperative hyperbaric oxygen therapy with restriction of transfusions in patients with HCC who have undergone partial hepatectomy",2011,"Ueno, S. and Sakoda, M. and Kurahara, H. and Iino, S. and Minami, K. and Ando, K. and Mataki, Y. and Maemura, K. and Ishigami, S. and Shinchi, H. and Natsugoe, S.","99-106",396,1692,"article","Langenbeck's Archives of Surgery"
"id_0000936","Pleural tuberculosis: an update",2010,"Udwadia, Zarir F. and Sen, Tiyas","399-406",16,1317,"article","Current Opinion in Pulmonary Medicine"
"id_0000937","""Two-step autologous grafting using HYAFF scaffolds in treating difficult diabetic foot ulcers: Results of a multicenter, randomized controlled clinical trial with long-term follow-up""",2011,"Uccioli, L. and Giurato, L. and Ruotolo, V. and Ciavarella, A. and Grimaldi, M. S. and Piaggesi, A. and Teobaldi, I. and Ricci, L. and Scionti, L. and Vermigli, C. and Seguro, R. and Mancini, L. and Ghirlanda, G.","80-85",10,1911,"article","International Journal of Lower Extremity Wounds"
"id_0000938","The effects of gabapentin on acute and chronic postoperative pain after coronary artery bypass graft surgery",2011,"Ucak, A. and Onan, B. and Sen, H. and Selcuk, I. and Turan, A. and Yilmaz, A. T.","824-829",25,542,"article","Journal of Cardiothoracic and Vascular Anesthesia"
"id_0000939","Once-daily dasatinib for treatment of patients with chronic myeloid leukemia",2009,"Tyler, Timothy","920-927",43,1045,"article","Annals of Pharmacotherapy"
"id_0000940","A phase II trial of dasatinib in patients with metastatic castration-resistant prostate cancer treated previously with chemotherapy",2013,"Twardowski, P. W. and Beumer, J. H. and Chen, C. S. and Kraft, A. S. and Chatta, G. S. and Mitsuhashi, M. and Ye, W. and Christner, S. M. and Lilly, M. B.","743-753",24,1228,"article","Anti-Cancer Drugs"
"id_0000941","A phase II trial of dasatinib in subjects with hormone-refractory prostate cancer previously treated with chemotherapy",2011,"Twardowski, P. and Chen, C. and Kraft, A. S. and Chatta, G. S. and Alexson, E. and Mitsuhashi, M. and Ye, W. and Lilly, M.",,29,1229,"article","Journal of Clinical Oncology"
"id_0000942","Does bedside chest ultrasound in the ICU improve early diagnosis and quick resolution of pleural effusion?",2009,"Tutino, L. and Spina, R. and Filippo, A. and Batacchi, S.","P4 (Abstract number)","Volume 13 Suppl 1",463,"article","Critical Care"
"id_0000943","[Current treatment strategy in malignant pleural effusion]",1996,"Turler, A. and Walter, M. and Schmitz-Rixen, T.","255-261",108,368,"article","Wiener Klinische Wochenschrift"
"id_0000944","Intrapleural urokinase in the management of parapneumonic empyema: a randomised controlled trial",2001,"Tuncozgur, B. and Ustunsoy, H. and Sivrikoz, M. C. and Dikensoy, O. and Topal, M. and Sanli, M. and Elbeyli, L.","658-660",55,833,"article","International Journal of Clinical Practice"
"id_0000945","[Pathogenetic agents in the complex treatment of patients with tuberculous pleurisy]",1989,"Tsymbalar, G. G. and Tudos, T. P. and Zhurzha, L. E.","23-Jul",,1092,"article","Problemy Tuberkuleza"
"id_0000946","Effect of clarithromycin in experimental empyema by multidrug-resistant Pseudomonas aeruginosa",2013,"Tsovolou, E. C. and Tzepi, I. M. and Spyridaki, A. and Tsaganos, T. and Karagianni, V. and Menenakos, E. and Liakou, P. and Sabracos, L. and Zografos, G. and Giamarellos-Bourboulis, E. J.",,,509,"article","APMIS"
"id_0000947","Evaluation of Src Tyr419 as a predictive biomarker in a neoadjuvant trial using dasatinib in resectable malignant pleural mesothelioma",2010,"Tsao, A. S. and Wistuba, I. I. and Mehran, R. J. and Gil, J. and Nunez, M. and Lee, J. and Lin, H. and Lippman, S. M. and Hong, W. K.",,28,606,"article","Journal of Clinical Oncology"
"id_0000948","An open-label phase II trial to assess to efficacy of sunitinib as an antieffusion agent in patients with malignant peritoneal and/or pleural effusions",2009,"Trinh, X. and Van Dam, P. and Tjalma, W. and Wojtasik, A. and Lybaert, W. and Rasschaert, M. and Rutten, A. and Prove, A. and Vermeulen, P. and Dirix, L.","e14647",27,1052,"article","Journal of Clinical Oncology"
"id_0000949","Preliminary findings of a phase II trial studying the efficacy of sunitinib as anti-effusion agent in patients with malignant effusions",2009,"Trinh, X. and Van Dam, P. and Tjalma, W. and Lybaert, W. and Rasschaert, M. and Vermeulen, P. and Dirix, L.","S362-S363",107,1384,"article","International Journal of Gynecology and Obstetrics"
"id_0000950","Tunnelled pleural catheters in malignant pleural effusion... Lancet. 2007 May 5;369(9572):1494-6",2007,"Tremblay, A. and Aelony, Y.",387,370,1909,"article","Lancet"
"id_0000951","Administration of pemetrexed immediately following gemcitabine as front-line therapy in advanced non-small cell lung cancer: a phase II trial",2006,"Treat, Joseph and Bonomi, Philip and McCleod, Michael and Christiansen, Neal P. and Mintzer, David M. and Monberg, Matthew J. and Ye, Zhishen and Chen, Ruqin and Obasaju, Coleman K.","77-83",53,27,"article","Lung Cancer"
"id_0000952","Fosfomycin update",2011,"Traunmuller, F. and Steinort, D. and Gattringer, R. and Graninger, W.","Sep-17",20,664,"article","Chemotherapie Journal"
"id_0000953","[Preliminary results of a cooperative study of the efficacy of combined treatment of lung cancer]",1983,"Trakhtenberg, A. Kh and Chissov, V. I. and Kiseleva, E. S. and Barchuk, A. S. and Vagner, R. I.","58-67",29,1386,"article","Voprosy Onkologii"
"id_0000954","Three-year results of surgical and combined treatment of lung cancer with a preoperative radiotherapy",1983,"Trakhtenberg, and A, K. and Kiseleva, and E, S. and Barchuk, and A, S. and Vagner, and R, I. and Glagolev, and A, N. and Daryalova, and S, L. and Dorfman, and M, V. and Zakharchenkov, and A, V. and Zvekotkina, and L, S. and Kaliev, and K, T. and et, and a, l","563-572",30,1836,"article","Neoplasma"
"id_0000955","""A multicentre, open-label, randomized comparative study of tigecycline versus ceftriaxone sodium plus metronidazole for the treatment of hospitalized subjects with complicated intra-abdominal infecti",2010,"Towfigh, S. and Pasternak, J. and Poirier, A. and Leister, H. and Babinchak, T.","1274-1281",16,999,"article","Clinical Microbiology and Infection"
"id_0000956","[Eighteen-year experience of cancer immunotherapies--evaluation of their therapeutic benefits and future]",1991,"Torisu, M. and Uchiyama, A. and Goya, T. and Iwasaki, K. and Katano, M. and Yamamoto, H. and Kimura, Y.","1212-1216",92,581,"article","Nippon Geka Gakkai Zasshi. Journal of Japan Surgical Society"
"id_0000957","Complete hemihepatic vascular exclusion versus pringle maneuver for liver resection: A comparative study",2011,"Tong, Y. and Yang, J. M. and Lai, E. C. H. and Lau, W. Y. and Wu, M. C.","1307-1311",58,316,"article","Hepato-Gastroenterology"
"id_0000958","Emulsion of Brucea Javanica oil in treatment of malignant pleural effusion",2012,"Tong, K. E. and Li, Z. D. and Zhu, W. W.","433-435",27,587,"article","Journal of Practical Oncology"
"id_0000959","Summary",2010,"Tomillero, A. and Moral, M. A.","247-288",32,1774,"article","Methods and Findings in Experimental and Clinical Pharmacology"
"id_0000960","Outcome of lung transplantation in elderly recipients",2011,"Tomaszek, S. C. and Fibla, J. J. and Dierkhising, R. A. and Scott, J. P. and Shen, K. H. R. and Wigle, D. A. and Cassivi, S. D.","726-731",39,1072,"article","European Journal of Cardio-thoracic Surgery"
"id_0000961","Socio-demographic correlates of respiratory disorders in east Sikkim",2010,"Tiwari, V. K. and Barua, A. and Kesari, S. P.",235,23,1726,"article","Journal International Medical Sciences Academy"
"id_0000962","Efficacy and safety of a single daily dose of gentamicin in hospitalized Indian children: A quasi-randomized trial",2009,"Tiwari, S. and Rehan, H. S. and Chandra, J. and Mathur, N. N. and Singh, V.","1096 1101",64,553,"article","Journal of Antimicrobial Chemotherapy"
"id_0000963","""Phase 2 trial of eritoran tetrasodium (E5564), a Toll-like receptor 4 antagonist, in patients with severe sepsis""",2010,"Tidswell, M. and Tillis, W. and Larosa, S. P. and Lynn, M. and Wittek, A. E. and Kao, R. and Wheeler, J. and Gogate, J. and Opal, S. M.","72-83",38,1135,"article","Critical Care Medicine"
"id_0000964","Randomised trial of intrapleural urokinase in the treatment of childhood empyema [Abstract]",2000,"Thomson, A. H. and Hull, J. and Kumar, R. and Wallis, C. and Balfour Lynn, I.","A20",55,1502,"article","Thorax"
"id_0000965","Randomised trial of intrapleural urokinase in the treatment of childhood empyema",2002,"Thomson, A. H. and Hull, J. and Kumar, M. R. and Wallis, C. and Balfour Lynn, I. M.","343-347",57,1501,"article","Thorax"
"id_0000966","Perioperative administration of angiotensin converting enzyme inhibitors decreases the severity and duration of pleural effusions following bidirectional cavopulmonary anastomosis",2001,"Thompson, L. D. and McElhinney, D. B. and Culbertson, C. B. and Hardy, C. E. and Brook, M. M. and Reddy, V. M. and Hanley, F. L.","195-200",11,1106,"article","Cardiology in the Young"
"id_0000967","Efficacy and safety of intrapleural instillation of alteplase in the management of complicated pleural effusion or empyema",2007,"Thommi, G. and Nair, C. K. and Aronow, W. S. and Shehan, C. and Meyers, P. and McLeay, M.","341-345",14,555,"article","American Journal of Therapeutics"
"id_0000968","Response to the installation of activase in the pleural cavity versus placebo in patients with complicated pleural effusions/empyema [Abstract]",2009,"Thommi, G. and McLeay, M. and Robison, K. and Christensen, M. and Buchmeyer, L. and Shehan, J. C.","A4487 [Poster #G116]",,1637,"article","""American Thoracic Society International Conference, May 15-20, 2009, San Diego"""
"id_0000969","A new bioabsorbable sleeve for lung staple-line reinforcement (FOREseal): report of a three-center phase II clinical trial",2006,"Thomas, Pascal and Massard, Gilbert and Porte, Henri and Doddoli, Christophe and Ducrocq, Xavier and Conti, Massimo","880-885",29,1018,"article","European Journal of Cardio-Thoracic Surgery"
"id_0000970","Blunt chest trauma in intensive care",2010,"Textoris, J. and Michel, F. and Charvet, A. and Martin, C. and Leone, M.","190-199",14,117,"article","Netherlands Journal of Critical Care"
"id_0000971","Early recognition of the 2009 pandemic influenza A (H1N1) pneumonia by chest ultrasound",2012,"Testa, Americo and Soldati, Gino and Copetti, Roberto and Giannuzzi, Rosangela and Portale, Grazia and Gentiloni-Silveri, Nicolo","R30",16,488,"article","""Critical Care (London, England)"""
"id_0000972","""Quality-of-life, efficacy and radiological features in talc pleurodesis by videothoracoscopy or small bore chest tube [Abstract]""",2008,"Terra, R. M. and Junqueira, J. J. and Teixeira, L. R. and Vargas, F. S. and Pego-Fernandes, P. M. and Jatene, F. B.","S65004",134,1480,"article","Chest"
"id_0000973","Safety and effectiveness of three different doses of silver nitrate for pleurodesis in patients with malignant pleural effusion: Preliminary results",2011,"Terra, R. M. and Bellato, R. T. and Teixeira, L. R. and Chate, R. C. and Jatene, F. B. and Camelo, L. K. and Fahel, M. G.","S134",14,1688,"article","Heart Surgery Forum"
"id_0000974","Pleural effusions evaluated by bedside echography in ICU patients [abstract]",1998,"Teixeira-Ribeiro, A. and Meshaka, P. and Arnulf, B. and Bouzar, N. and Richard, J. C. and Wolff, M. A. and Herman, B. and Wysocki, M.","A311",157,1297,"article","American Journal of Respiratory and Critical Care Medicine"
"id_0000975","Antibiotic treatment of patients with pneumonia and pleural effusion",1998,"Teixeira, L. R. and Villarino, M. A.","230-234",4,70,"article","Current Opinion in Pulmonary Medicine"
"id_0000976","Intracavitary treatment of malignant pleural effusions",1982,"Tattersall, M. H. N.","288-292",1,782,"article","Chemioterapia"
"id_0000977","Pleural effusions",1992,"Tattersall, M.","642-646",4,1295,"article","Current Opinion in Oncology"
"id_0000978","""Failure of carbazochrome sodium sulfonate (AC-17) to prevent dengue vascular permeability or shock: a randomized, controlled trial""",1997,"Tassniyom, S. and Vasanawathana, S. and Dhiensiri, T. and Nisalak, A. and Chirawatkul, A.","525-528",131,629,"article","Journal of Pediatrics"
"id_0000979","Preemptive antibiotic treatment for VAP",2013,"Tasaki, O.","S12-S13",42,1377,"article","International Journal of Antimicrobial Agents"
"id_0000980","""A phase 2, randomized study of SB-485232, rhIL-18, in patients with previously untreated metastatic melanoma""",2009,"Tarhini, Ahmad A. and Millward, Michael and Mainwaring, Paul and Kefford, Richard and Logan, Ted and Pavlick, Anna and Kathman, Steven J. and Laubscher, Kevin H. and Dar, Mohammed M. and Kirkwood, John M.","859-868",115,1136,"article","Cancer"
"id_0000981","Etanercept associated acute onset heart failure requiring biventricular assist devices",2011,"Tanna, M. S. and Leung, S. and LeFrancois, D.","S465-S466",26,601,"article","Journal of General Internal Medicine"
"id_0000982","The effectt of high Dose of HASL instillation intrapleural in malignent pleural effusion",2000,"Tang, Z. L.","218-219",27,550,"article","Cancer Research on Prevention and Treatment"
"id_0000983","Impact of perioperative administration of synbiotics in patients with esophageal cancer undergoing esophagectomy: A prospective randomized controlled trial",2012,"Tanaka, K. and Yano, M. and Motoori, M. and Kishi, K. and Miyashiro, I. and Ohue, M. and Ohigashi, H. and Asahara, T. and Nomoto, K. and Ishikawa, O.","832-842",152,722,"article","Surgery (United States)"
"id_0000984","ABT-869 in non-small cell lung cancer (NSCLC): Interim results",2009,"Tan, E. and Salgia, R. and Besse, B. and Goss, G. and Gandara, D. R. and Hanna, N. and Steinberg, J. and Steinberg, J. and Qian, J. and Carlson, D. M. and Soo, R.",8074,27,6,"article","Journal of Clinical Oncology"
"id_0000985","Differentiating therapy in acute myeloid leukemia",1996,"Tallman, M. S.","1262-1268",10,442,"article","Leukemia"
"id_0000986","Differentiating therapy in acute myeloid leukemia",1996,"Tallman, M. S.","S33-38","10 Suppl 2",443,"article","Leukemia"
"id_0000987","Utility of intrapleural streptokinase in management of chronic empyemas",2003,"Talib, S. H. and Verma, G. R. and Arshad, M. and Tayade, B. O. and Rafeeque, A.","464-468",51,1948,"article","Journal of the Association of Physicians of India"
"id_0000988","Computer aided detection of major pleural space findings in emergent chest CT",2011,"Takehana, C. and Tran, N. and Mayer, A. and Kang, Y. and Konen, E.",470,18,327,"article","Emergency Radiology"
"id_0000989","Targeted therapy against all three VEGF receptors by cediranib enhances the antitumor and anti-metastatic effects of paclitaxel and radiation in an orthotopic human lung cancer model",2010,"Takahashi, O. and Komaki, R. and Tailor, R. and Jurgensmeier, J. M. and Ryan, A. and Smith, P. D. and Jacoby, J. J. and Korshunova, M. V. and Herbst, R. S. and O'Reilly, M. S.","S511",5,1802,"article","Journal of Thoracic Oncology"
"id_0000990","""A multi-centre, double-blind study of serrapeptase versus placebo in post-antrotomy buccal swelling""",1984,"Tachibana, M. and Mizukoshi, O. and Harada, Y. and Kawamoto, K. and Nakai, Y.","526-530",3,998,"article","Pharmatherapeutica"
"id_0000991","Does fibrin glue reduce lymph leakage (pleural effusion) after extended esophagectomy? Prospective randomized clinical trial",2003,"Tachibana, Mitsuo and Kinugasa, Shoichi and Yoshimura, Hiroshi and Dhar, Dipok Kumar and Ueda, Shuhei and Fujii, Toshiyuki and Kohno, Hitoshi and Nagasue, Naofumi","776-781",27,465,"article","World Journal of Surgery"
"id_0000992","Phase II trial of weekly nab-paclitaxel with GM-CSF as chemoimmunotherapy for platinum-resistant epithelial ovarian cancer",2011,"Swensen, R. E. and Childs, J. and Higgins, D. and Gooley, T. and Goff, B. A. and Fintak, P. A. and Buening, B. and Disis, M. L.",,29,1247,"article","Journal of Clinical Oncology"
"id_0000993","Our experience with transoral incisionless plication of gastroesophageal reflux disease: NOTES procedure",2011,"Svoboda, P. and Kantorova, I. and Kozumplik, L. and Scheer, P. and Radvan, M. and Radvanova, J. and Krass, V. and Horalek, F.","1208-1213",58,1069,"article","Hepato-Gastroenterology"
"id_0000994","""Brachytherapy boost vs teletherapy boost in palliation of symptomatic, locally advanced non-small cell lung cancer: Preliminary analysis of a randomized, prospective study""",2001,"Sur, R. and Ahmed, S. N. and Donde, B. and Morar, R. and Mohamed, G. and Sur, M. and Pacella, J. A. and Merwe, D. and Feldman, C.","309-315",17,122,"article","Journal of Brachytherapy International"
"id_0000995","Radiation Therapy Oncology Group Protocol 02-29: A phase II trial of neoadjuvant therapy with concurrent chemotherapy and full-dose radiation therapy followed by surgical resection and consolidative t",2012,"Suntharalingam, M. and Paulus, R. and Edelman, M. J. and Krasna, M. and Burrows, W. and Gore, E. and Wilson, L. D. and Choy, H.","456-463",84,1481,"article","International Journal of Radiation Oncology Biology Physics"
"id_0000996","Randomized clinical trial of the effects of abdominal drainage after elective hepatectomy using the crushing clamp method",2006,"Sun, H. C. and Qin, L. X. and Lu, L. and Wang, L. and Ye, Q. H. and Ren, N. and Fan, J. and Tang, Z. Y.","422-426",93,1506,"article","British Journal of Surgery"
"id_0000997","Clinical observation of Yadanzhi grease and DDP on treating malignant pleural effusion",2002,"Sun, D. X. and Shen, H. D. and Ji, C. L. and Wei, Q. L.","604-606",24,196,"article","Chinese Traditional Patent Medicine"
"id_0000998","[Multi-center trial of gemcitabine for 49 patients with advanced pancreatic cancer]",2003,"Sumii, Toshihiko and Funakoshi, Akihiro and Ito, Tetsuhide and Mizumoto, Kazuhiro and Tanaka, Masao and Migita, Yoshikatsu and Sakai, Terufumi and Shinozaki, Hirotsugu and Yamaguchi, Hiroya and Niyahara, Toshihiko and Muranaka, Toru and Eriguchi, Naofumi and Ueki, Toshiharu and Fukuoka Pancreatic Cancer Chemotherapy, Group","971-976",30,994,"article","Gan to Kagaku Ryoho [Japanese Journal of Cancer & Chemotherapy]"
"id_0000999","A bedside assay to detect streptococcus pneumoniae in children with empyema",2011,"Strachan, R. E. and Cornelius, A. and Gilbert, G. L. and Gulliver, T. and Martin, A. and McDonald, T. and Nixon, G. M. and Roseby, R. and Ranganathan, S. and Selvadurai, H. and Smith, G. and Soto-Martinez, M. and Suresh, S. and Teoh, L. and Thapa, K. and Wainwright, C. E. and Jaffe, A.","179-183",46,101,"article","Pediatric Pulmonology"
"id_0001000","""[Therapeutic pleurodesis in spontaneous pneumothorax, malignant pleural effusion, heart insufficiency and chylothorax]""",1991,"Storm, H. K. and Viskum, K.","989-992",153,1811,"article","Ugeskrift for Laeger"
"id_0001001","Dasatinib dose-optimization study in chronic phase chronic myeloid leukemia (CML-CP): Three-year follow-up with dasatinib 100 mg once daily and landmark analysis of cytogenetic response and progressio",2009,"Stone, R. M. and Kim, D. W. and Kantarjian, H. M. and Rousselot, P. and Hochhaus, A. and Dorlhiac-Llacer, P. E. and Milone, J. and Matloub, Y. and Lambert, A. and Shah, N. P.",7007,27,383,"article","Journal of Clinical Oncology"
"id_0001002","B-RIPPED ultrasonography scan for evaluation of emergency department patients with shortness of breath",2012,"Stewart, V. M. and Bjornsson, H. and Ravi, B. and Byars, D. and Clinton, M.","S18",60,124,"article","Annals of Emergency Medicine"
"id_0001003","The argument for aggressive coiling of aortopulmonary collaterals in single ventricle patients",2009,"Stern, H. J.","897-900",74,83,"article","Catheterization and Cardiovascular Interventions"
"id_0001004","A phase I clinical trial of single-dose intrapleural IFN-beta gene transfer for malignant pleural mesothelioma and metastatic pleural effusions: high rate of antitumor immune responses.[Erratum appear",2007,"Sterman, Daniel H. and Recio, Adri and Carroll, Richard G. and Gillespie, Colin T. and Haas, Andrew and Vachani, Anil and Kapoor, Veena and Sun, Jing and Hodinka, Richard and Brown, Jennifer L. and Corbley, Michael J. and Parr, Michael and Ho, Mitchell and Pastan, Ira and Machuzak, Michael and Benedict, William and Zhang, Xin-qiao and Lord, Elaina M. and Litzky, Leslie A. and Heitjan, Daniel F. and June, Carl H. and Kaiser, Larry R. and Vonderheide, Robert H. and Albelda, Steven M. and Kanther, Michelle","4456-4466",13,1145,"article","Clinical Cancer Research"
"id_0001005","Interferon beta adenoviral gene therapy in a patient with ovarian cancer",2006,"Sterman, D. H. and Gillespie, C. T. and Carroll, R. G. and Coughlin, C. M. and Lord, E. M. and Sun, J. and Haas, A. and Recio, A. and Kaiser, L. R. and Coukos, G. and June, C. H. and Albelda, S. M. and Vonderheide, R. H.","633-639",3,763,"article","Nature Clinical Practice Oncology"
"id_0001006","Prospective multicenter randomized phase III study of weekly versus standard docetaxel (D2) for first-line treatment of metastatic breast cancer",2010,"Stemmler, H. J. and Harbeck, N. and Groll De Rivera, I. and Vehling Kaiser, U. and Rauthe, G. and Abenhardt, W. and Artmann, A. and Sommer, H. and Meerpohl, H. G. and Kiechle, M. and Heinemann, V.","197-203",79,1436,"article","Oncology"
"id_0001007","Prospective multicenter randomized phase III study of weekly versus standard docetaxel plus doxorubicin (D4) for first-line treatment of metastatic breast cancer",2010,"Stemmler, H. J. and Harbeck, N. and Groll De Rivera, I. and Vehling Kaiser, U. and Rauthe, G. and Abenhardt, W. and Artmann, A. and Sommer, H. and Meerpohl, H. G. and Kiechle, M. and Heinemann, V.","204-210",79,1437,"article","Oncology"
"id_0001008","Evaluation of individual criteria for low probability interpretation of ventilation-perfusion lung scans",1996,"Stein, P. D. and Relyea, B. and Gottschalk, A.","577-581",37,604,"article","Journal of Nuclear Medicine"
"id_0001009","Achalasia",2013,"Stavropoulos, S. N. and Modayil, R. and Friedel, D.","53-75",23,8,"article","Gastrointestinal Endoscopy Clinics of North America"
"id_0001010","Pulmonary outcomes of off-pump vs on-pump coronary artery bypass surgery in a randomized trial",2005,"Staton, Gerald W. and Williams, Willis H. and Mahoney, Elizabeth M. and Hu, Jeff and Chu, Haitao and Duke, Peggy G. and Puskas, John D.","892-901",127,1475,"article","Chest"
