"ID","title","year","author","pages","volume","number","ENTRYTYPE","journal"
"id_0001426","Severity prediction rules in community acquired pneumonia: a validation study",2000,"Lim, W. S. and Lewis, S. and Macfarlane, J. T.","219-223",55,1713,"article","Thorax"
"id_0001427","Empirical treatment with fibrinolysis and early surgery reduces the duration of hospitalization in pleural sepsis",1999,"Lim, T. K. and Chin, N. K.","514-518",13,584,"article","European Respiratory Journal"
"id_0001428","Preliminary analysis of a prospective phase II study of hyperthermic intraperitoneal chemotherapy in patients with advanced epithelial ovarian cancer",2009,"Lim, M. and Kang, S. and Choi, J. and Lee, K. and Song, Y. and Seo, S. and Park, S.","S147-S148",112,1382,"article","Gynecologic Oncology"
"id_0001429","Hyperthermic intraperitoneal chemotherapy following extensive cytoreductive surgery in patients with primary advanced epithelial ovarian cancer: Result of a prospective phase II study",2013,"Lim, M. and Im, M. and Yoo, H. and Seo, S. and Kang, S. and Park, S.","e3-e4",130,697,"article","Gynecologic Oncology"
"id_0001430","The management of parapneumonic effusions and empyema",1998,"Light, R. W.","227-229",4,936,"article","Current Opinion in Pulmonary Medicine"
"id_0001431","Meta-analysis of simultaneous versus staged resection for synchronous colorectal liver metastases",2013,"Li, Z. Q. and Liu, K. and Duan, J. C. and Li, Z. and Su, C. Q. and Yang, J. H.","72-83",43,969,"article","Hepatology Research"
"id_0001432","A comparative study of antiviral therapy after resection of hepatocellular carcinoma in the immune-active phase of hepatitis B virus infection",2010,"Li, N. and Lai, E. C. H. and Shi, J. and Guo, W. X. and Xue, J. and Huang, B. and Lau, W. Y. and Wu, M. C. and Cheng, S. Q.","179-185",17,247,"article","Annals of Surgical Oncology"
"id_0001433","""The efficacy and safety of the novel aldosterone antagonist eplerenone in children with hypertension: A randomized, double-blind, dose-response study""",2010,"Li, J. S. and Flynn, J. T. and Portman, R. and Davis, I. and Ogawa, M. and Shi, H. and Pressler, M. L.","282-287",157,559,"article","Journal of Pediatrics"
"id_0001434","Randomized controlled trial of neoadjuvant chemotherapy with cisplatin and vinorelbine in patients with stage IIIA non-small cell lung cancer in China",2009,"Li, J. and Yu, L. C. and Chen, P. and Shi, S. B. and Dai, C. H. and Wu, J. R.","87-94",5,1523,"article","Asia-Pacific Journal of Clinical Oncology"
"id_0001435","Preoperative steroid administration in liver resection: A systematic review and meta-analysis",2013,"Li, H. and Wei, Y. and Li, B.","160-169",60,1393,"article","Hepato-Gastroenterology"
"id_0001436","[Therapy effect of highly agglutinative staphylococin combined cisplatin on malignant pleural effusion]",2000,"Li, Hong and Bao, X. H. and Li, Y. G.",59,17,1815,"article","Journal of Clinical Internal Medicine"
"id_0001437","Complications associated with thoracic pedicle screws in spinal deformity",2010,"Li, G. and Lv, G. and Passias, P. and Kozanek, M. and Metkar, U. S. and Liu, Z. and Wood, K. B. and Rehak, L. and Deng, Y.","1576-1584",19,319,"article","European Spine Journal"
"id_0001438","""Randomized, double-blind comparative study of intravenous ciprofloxacin versus ceftazidime in the treatment of serious infections""",1989,"Levine, D. P. and McNeil, P. and Lerner, S. A.","S160S-163",87,1594,"article","American Journal of Medicine"
"id_0001439","Intrapleural palliative treatment of malignant pleural effusions with talcum versus placebo (pleural tube alone)",2000,"Leverenz, and Heckmayr, and Tischer, Neuhauss and Gatzemeier,","S 274-5",29,814,"article","Lung Cancer"
"id_0001440","Pharmacotherapy options for advanced thyroid cancer: A systematic review",2012,"Lerch, C. and Richter, B.","67-85",72,1124,"article","Drugs"
"id_0001441","Humidified high flow nasal oxygen in the emergency department: Feasibility and interest",2010,"Lenglet, H. and Sztrymf, B. and Leroy, C. and Brun, P. and Dreyfuss, D. and Ricard, J.",,181,694,"article","American Journal of Respiratory and Critical Care Medicine"
"id_0001442","New diagnostic and management tools in pleural effusion",2010,"Lee, Y. G.",5,15,1019,"article","Respirology"
"id_0001443","Adenosine deaminase levels in nontuberculous lymphocytic pleural effusions",2001,"Lee, Y. C. and Rogers, J. T. and Rodriguez, R. M. and Miller, K. D. and Light, R. W.","356-361",120,21,"article","Chest"
"id_0001444","A comparative study of three therapeutic modalities in loculated tuberculous pleural effusions",1996,"Lee, S. H. and Lee, S. R. and Lee, S. Y. and Park, S. M. and Suh, J. K. and Cho, J. Y. and Shim, J. J. and In, K. H. and Yoo, S. H. and Kang, K. H.","683-692",43,259,"article","Tuberculosis and Respiratory Diseases"
"id_0001445","Procalcitonin as a diagnostic marker in differentiating parapneumonic effusion from tuberculous pleurisy or malignant effusion",2013,"Lee, S. H. and Lee, E. J. and Min, K. H. and Hur, G. Y. and Lee, S. Y. and Kim, J. H. and Shin, C. and Shim, J. J. and In, K. H. and Kang, K. H. and Lee, S. Y.",,,1411,"article","Clinical Biochemistry"
"id_0001446","Thoracic empyema: current opinions in medical and surgical management",2010,"Lee, S. F. and Lawrence, D. and Booth, H. and Morris-Jones, S. and Macrae, B. and Zumla, A.","194-200",16,1822,"article","Current Opinion in Pulmonary Medicine"
"id_0001447","Pleuroscopy in 2013",2013,"Lee, Pyng and Colt, Henri G.","81-91",34,1339,"article","Clinics in Chest Medicine"
"id_0001448","""Vandetanib versus placebo in patients with advanced non-small-cell lung cancer after prior therapy with an epidermal growth factor receptor tyrosine kinase inhibitor: Arandomized, double-blind phase",2012,"Lee, J. S. and Hirsh, V. and Park, K. and Qin, S. and Blajman, C. R. and Perng, R. P. and Chen, Y. M. and Emerson, L. and Langmuir, P. and Manegold, C.","1114-1121",30,1958,"article","Journal of Clinical Oncology"
"id_0001449","Laparoscopic incidental appendectomy during laparoscopic surgery for ovarian endometrioma",2011,"Lee, J. H. and Choi, J. S. and Jeon, S. W. and Son, C. E. and Bae, J. W. and Hong, J. H. and Lee, K. W. and Lee, Y. S.","28.e1-28.e5",204,863,"article","American Journal of Obstetrics and Gynecology"
"id_0001450","Medical management of malignant pleural effusions",2011,"Lee, G.","S10-S11",6,955,"article","Journal of Thoracic Oncology"
"id_0001451","""Corticosteroids in the treatment of tuberculous pleurisy. A double-blind, placebo-controlled, randomized study""",1988,"Lee, C. H. and Wang, W. J. and Lan, R. S. and Tsai, Y. H. and Chiang, Y. C.","1256-1259",94,348,"article","Chest"
"id_0001452","Therapeutic effect of prednisolone in tuberculous pleurisy - A prospective study for the prevention of the pleural adhesion",1999,"Lee, B. H. and Jee, H. S. and Choi, J. C. and Park, Y. B. and An, C. H. and Kim, J. Y. and Park, I. W. and Choi, B. W. and Hue, S. H.","481-488",46,1810,"article","Tuberculosis & Respiratory Diseases"
"id_0001453","Treatment of malignant pleural effusions with intrapleural Corynebacterium parvum or tetracycline",1985,"Leahy, B. C. and Honeybourne, D. and Brear, S. G. and Carroll, K. B. and Thatcher, N. and Stretton, T. B.","50-54",66,1876,"article","European Journal of Respiratory Diseases"
"id_0001454","A multicenter phase II randomized study of docetaxel (D)/gemcitabine (G) weekly followed by erlotinib (E) after progression versus erlotinib followed by docetaxel/gemcitabine after progression in adva",2010,"Le Caer, H. and Barlesi, F. and Corre, R. and Jullian, H. and Bota, S. and Falchero, L. and Vergnenegre, A. and Dujon, C. and Delhoume, J. Y. and Chouaid, C.",,28,991,"article","Journal of Clinical Oncology"
"id_0001455","Diagnostic mini-video assisted thoracic surgery. Effectiveness and accuracy of new generation 2.0 mm instruments",2002,"Lazopoulos, G. and Kotoulas, C. and Kokotsakis, J. and Foroulis, C. and Lioulias, A.","1793-1795",16,434,"article","Surgical Endoscopy"
"id_0001456","Use of rib belts in acute rib fractures",1989,"Lazcano, A. and Dougherty, J. M. and Kruger, M.","97-100",7,1939,"article","American Journal of Emergency Medicine"
"id_0001457","Procalcitonin usefulness for the initiation of antibiotic treatment in intensive care unit patients",2012,"Layios, N. and Lambermont, B. and Canivet, J. L. and Morimont, P. and Preiser, J. C. and Garweg, C. and Ledoux, D. and Frippiat, F. and Piret, S. and Giot, J. B. and Wiesen, P. and Meuris, C. and Massion, P. and Leonard, P. and Nys, M. and Lancellotti, P. and Chapelle, J. P. and Damas, P.","2304-2309",40,1412,"article","Critical Care Medicine"
"id_0001458","Complications of intrapleural BCG in the treatment of operable non-small-cell bronchial carcinoma",1982,"Law, M. R. and Lam, W. K. and Studdy, P. R. and Pugsley, W. B. and Hodson, M. E.","151-156",76,322,"article","British Journal of Diseases of the Chest"
"id_0001459","""Oral application of bacterial lysate in infancy decreases the risk of atopic dermatitis in children with 1 atopic parent in a randomized, placebo-controlled trial""",2012,"Lau, S. and Gerhold, K. and Zimmermann, K. and Ockeloen, C. W. and Rossberg, S. and Wagner, P. and Sulser, C. and Bunikowski, R. and Witt, I. and Wauer, J. and Beschorner, J. and Menke, G. and Hamelmann, E. and Wahn, U.","1040-1047",129,1064,"article","Journal of Allergy and Clinical Immunology"
"id_0001460","""Phase I/II trial of custirsen (OGX-011), an inhibitor of clusterin, in combination with a gemcitabine and platinum regimen in patients with previously untreated advanced non-small cell lung cancer""",2012,"Laskin, J. J. and Nicholas, G. and Lee, C. and Gitlitz, B. and Vincent, M. and Cormier, Y. and Stephenson, J. and Ung, Y. and Sanborn, R. and Pressnail, B. and Nugent, F. and Nemunaitis, J. and Gleave, M. E. and Murray, N. and Hao, D.","579-586",7,1190,"article","Journal of Thoracic Oncology"
"id_0001461","Comparison of nilotinib and imatinib in patients (pts) with newly diagnosed chronic myeloid leukemia in chronic phase (CML-CP): ENESTnd beyond one year",2010,"Larson, R. A. and Le Coutre, P. D. and Reiffers, J. and Hughes, T. P. and Saglio, G. and Edrich, P. and Hoenekopp, A. and Gallagher, N. J. and Kantarjian, H. and Hochhaus, A.",,28,288,"article","Journal of Clinical Oncology"
"id_0001462","Aspiration in the treatment of primary tuberculous pleural effusion",1958,"Large, S. E. and Levick, R. K.","1512-1514",1,88,"article","Br Med J"
"id_0001463","""Chemical pleurodesis with oxyteracycline, doxycycline or talc of malignant pleural effusions [abstract]""",1995,"Lantos, A. and Tarjan, E. and Bartfai, Z. and Varnai, Zs and Zsiray, M. and Magyar, P.","S536","8 Suppl 19",162,"article","European Respiratory Journal. Supplement."
"id_0001464","Analysis of patients (pts) with chronic phase chronic myeloid leukemia (CML-CP) who develop pleural effusion on first-line dasatinib: Management and outcomes",2011,"Laneuville, P. and Baccarani, M. and Cortes, J. E. and Hochhaus, A. and Kantarjian, H. and Shah, N. P. and Bradley-Garelik, M. B. and Zhu, C. and Porkka, K.",,29,45,"article","Journal of Clinical Oncology"
"id_0001465","Malignant pleural effusion treated by tetracycline sclerotherapy. A comparison of single vs repeated instillation",1988,"Landvater, L. and Hix, W. R. and Mills, M. and Siegel, R. S. and Aaron, B. L.","1196-1198",93,916,"article","Chest"
"id_0001466","Biliary stenting",2009,"Lanciego, C.",190,32,106,"article","CardioVascular and Interventional Radiology"
"id_0001467","Clinical evaluation of a novel 12-hole irrigated tip catheter ablation system for the treatment of typical atrial flutter - Results from the Duo FLAIR clinical study",2013,"Lakkireddy, D. and Sangrigoli, R. and Sloan, S. and Wiseman, M. and Weiss, R. and Molin, F. and Kanaan, N. and Awasthi, Y. and Mahapatra, S.","97-103",37,188,"article","Journal of Interventional Cardiac Electrophysiology"
"id_0001468","Pigtail drainage in the treatment of tuberculous pleural effusions: a randomised study",2003,"Lai, Y. F. and Chao, T. Y. and Wang, Y. H. and Lin, A. S.","149-151",58,1274,"article","Thorax"
"id_0001469","""Large scale, postlicensure, selective vaccination of Chilean infants with PRP-T conjugate vaccine: Practicality and effectiveness in preventing invasive Haemophilus influenzae type b infections""",1996,"Lagos, R. and Horwitz, I. and Toro, J. and San, M. O. and Abrego, P. and Bustamante, C. and Wasserman, S. S. and Levine, O. S. and Levine, M. M.","216-222",15,868,"article","Pediatric Infectious Disease Journal."
"id_0001470","""A study to compare the efficiency of sterile talc, tetracycline and bleomycin as sclerosing agents for medical pleurodesis in the treatment of malignant pleural effusions [Abstract]""",2004,"Ladd, B. and Tuggey, J. and Bowker, C. and Arnold, A. G. and Henry, M. T.","ii39",59,1767,"article","Thorax"
"id_0001471","""Pleural effusions following cardiac surgery: prevalence, risk factors, and clinical features""",2009,"Labidi, M. and Baillot, R. and Dionne, B. and Lacasse, Y. and Maltais, F. and Boulet, L. P.","1604-1611",136,1298,"article","CHEST"
"id_0001472","Kinase inhibitors: A new class of antirheumatic drugs",2012,"Kyttaris, V. C.","245-250",6,857,"article","""Drug Design, Development and Therapy"""
"id_0001473","Prevention of pleural effusion following hepatectomy using argon beam coagulation",2003,"Kwon, A. H. and Matsui, Y. and Satoi, S. and Kaibori, M. and Kamiyama, Y.","302-305",90,1403,"article","British Journal of Surgery"
"id_0001474","[Results of ledakrin treatment of patients with neoplastic effusions]",1979,"Kwasniewska-Rokicinska, C. and Zielonkowa, I. and Dedyk-Drosik, B. and Drosik, K.","303-306",29,1646,"article","Nowotwory"
"id_0001475","The effects of urokinase instillation therapy via percutaneous transthoracic catheter in loculated tuberculous pleural effusion: a randomized prospective study",2004,"Kwak, Seung Min and Park, Chan Sup and Cho, Jae Hwa and Ryu, Jeong Seon and Kim, Sei Kyu and Chang, Joon and Kim, Sung Kyu","822-828",45,549,"article","Yonsei Medical Journal"
"id_0001476","Pulmonary resection",1977,"Kvale, P. A. and Ranga, V. and Kopacz, M. and Cox, F. and Magilligan, D. J. and Davila, J. C.","64-68","70 Suppl 1",1476,"article","Southern Medical Journal"
"id_0001477","Therapy of parapneumonic effusions in children: video-assisted thoracoscopic surgery versus conventional thoracostomy drainage",2006,"Kurt, Beth A. and Winterhalter, Kimberly M. and Connors, Robert H. and Betz, Bradford W. and Winters, John W.","e547-53",118,1817,"article","Pediatrics"
"id_0001478","Chest tube drainage of transudative pleural effusions hastens liberation from mechanical ventilation",2011,"Kupfer, Y. and Seneviratne, C. and Chawla, K. and Ramachandran, K. and Tessler, S.","519-523",139,167,"article","CHEST"
"id_0001479","Diagnosing tuberculous pleural effusion: comparative sensitivity of mycobacterial culture and histopathology",1981,"Kumar, S. and Seshadri, M. S. and Koshi, G. and John, T. J.",20,283,418,"article","British Medical Journal Clinical Research Ed."
"id_0001480","Enteral versus parenteral feeding. Effects on septic morbidity after blunt and penetrating abdominal trauma",1992,"Kudsk, K. A. and Croce, M. A. and Fabian, T. C. and Minard, G. and Tolley, E. A. and Poret, H. A. and Kuhl, M. R. and Brown, R. O.","503-11; discussion 511-3",215,593,"article","Annals of Surgery"
"id_0001481","Oral vinorelbine (NVBO) at three weeklyflat-dose intakes concomitantly with thoracic radiotherapy (TRT) in locally advanced or inoperable stage III non-small cell lung cancer (NSCLC) : results of a ph",2008,"Krzakowski, M. J. and Gridelli, C. and Paccagnella, A. and Aslanis, V. and Perraud, K. and Lucas, C.","viii94-viii95",19,1066,"article","Annals of Oncology"
"id_0001482","Oral vinorelbine and cisplatin as induction chemotherapy and concomitant chemo-radiotherapy in stage III non-small cell lung cancer: final results of an international phase II trial",2008,"Krzakowski, Maciej and Provencio, Mariano and Utracka-Hutka, Beata and Villa, Eugenio and Codes, Manuel and Kuten, Abraham and Henke, Michael and Lopez, Massimo and Bell, David and Biti, Giampaolo and Merimsky, Ofer and Beorchia, Aulo and Riggi, Marcello and Caux, Noel-Raphael and Pouget, Jean-Christophe and Dubray, Bernard and David, Philippe","994-1002",3,1067,"article","Journal of Thoracic Oncology: Official Publication of the International Association for the Study of Lung Cancer"
"id_0001483","Phase I trial of anti-CD22 recombinant immunotoxin moxetumomab pasudotox (CAT-8015 or HA22) in patients with hairy cell leukemia",2012,"Kreitman, R. J. and Tallman, M. S. and Robak, T. and Coutre, S. and Wilson, W. H. and Stetler-Stevenson, M. and FitzGerald, D. J. and Lechleider, R. and Pastan, I.","1822-1828",30,1163,"article","Journal of Clinical Oncology"
"id_0001484","Phase II trial of recombinant immunotoxin RFB4(dsFv)-PE38 (BL22) in patients with hairy cell leukemia",2009,"Kreitman, R. J. and Stetler-Stevenson, M. and Margulies, I. and Noel, P. and FitzGerald, D. J. P. and Wilson, W. H. and Pastan, I.","2983-2990",27,1243,"article","Journal of Clinical Oncology"
"id_0001485","""Randomized controlled, multicentre clinical trial comparing a dual-probe ultrasonic lithotrite with a single-probe lithotrite for percutaneous nephrolithotomy""",2011,"Krambeck, A. E. and Miller, N. L. and Humphreys, M. R. and Nakada, S. Y. and Denstedt, J. D. and Razvi, H. and Preminger, G. M. and Nadler, R. B. and Matlaga, B. R. and Paterson, R. F. and Chew, B. H. and Munch, L. C. and Handa, S. E. and Lingeman, J. E.","824-828",107,1530,"article","BJU International"
"id_0001486","The management of malignant pleural effusions secondary in ovarian cancer: talc pleurodesis versus bleomycin pleurodesis [abstract]",2004,"Koutsogiorgou, A. G. and Stamatelopoulos, A. T. and Thanopoulou, E. and Baltayannis, N. and Anagnostakis, E. and Lazaridis, G. and Nikolousos, S. and Chatzimichalis, A.","""15, Abstract 049""","14 Suppl 1",931,"article","International Journal of Gynecological Cancer"
"id_0001487","A phase II study of bortezomib and gemcitabine in relapsed mantle cell lymphoma from the National Cancer Institute of Canada Clinical Trials Group (IND 172)",2011,"Kouroukis, C. T. and Fernandez, L. A. V. and Crump, M. and Chua, N. S. and Buckstein, R. and Turner, R. and Assouline, S. and Klasa, R. J. and Walsh, W. and Powers, J. and Eisenhauer, E.","394-399",52,1202,"article","Leukemia and Lymphoma"
"id_0001488","""A randomized phase 2 study of temozolomide and bevacizumab or nab-paclitaxel, carboplatin, and bevacizumab in patients with unresectable stage IV melanoma: A North Central Cancer Treatment Group stud",2013,"Kottschade, L. A. and Suman, V. J. and Perez, D. G. and McWilliams, R. R. and Kaur, J. S. and Amatruda Iii, T. T. and Geoffroy, F. J. and Gross, H. M. and Cohen, P. A. and Jaslowski, A. J. and Kosel, M. L. and Markovic, S. N.","586-592",119,1538,"article","Cancer"
"id_0001489","The value of extended postoperative antibiotic prophylaxis after laparoscopic cholecystectomy in acute cholecystitis",2013,"Kortram, K. and Van Ramshorst, B. and Vlaminckx, B. J. M. and Wiezer, M. J. and Boerma, D.","S123",27,1956,"article","Surgical Endoscopy and Other Interventional Techniques"
"id_0001490","The value of extended postoperative antibiotic prophylaxis after laparoscopic cholecystectomy in acute cholecystitis",2012,"Kortram, K. and Van Ramshorst, B. and Vlaminckx, B. and Wiezer, M. and Boerma, D.",24,14,1955,"article","HPB"
"id_0001491","A randomised trial of intracavitary quinacrine or blemycin in the control of malignant pleural effusions [abstract]",1993,"Koolen, M. G. J. and Veenhof, C. H. N. and Braat, M. C. P. and Jansen, H. M.","S290","6 Suppl 17",1500,"article","European Respiratory Journal. Supplement."
"id_0001492","Thoracic radiotherapy within 6 weeks with concurrent chemotherapy improved outcome of patients with limited stage small cell lung cancer (LS-SCLC)",2012,"Komaki, R. U. and Allen, P. and Wei, X. and Gomez, D. and Fossella, F. and Heymach, J. and Welsh, J. and O'Reilly, M. and Lin, S. and Cox, J. D.","S217",7,1824,"article","Journal of Thoracic Oncology"
"id_0001493","Chemical pleurodesis in malignant pleural effusions: a randomised prospective study of mepacrine versus bleomycin",1993,"Koldsland, S. and Svennevig, J. L. and Lehne, G. and Johnson, E.","790-793",48,161,"article","Thorax"
"id_0001494","Value of chest ultrasonography versus decubitus roentgenography for thoracentesis",1986,"Kohan, J. M. and Poe, R. H. and Israel, R. H. and Kennedy, J. D. and Benazzi, R. B. and Kallay, M. C. and Greenblatt, D. W.","1124-1126",133,1953,"article","American Review of Respiratory Disease"
"id_0001495","Neutron vs. photon radiation therapy for inoperable regional non-small cell lung cancer: results of a multicenter randomized trial",1993,"Koh, W. J. and Krall, J. M. and Peters, L. J. and Maor, M. H. and Laramore, G. E. and Burnison, C. M. and Davis, L. W. and Zink, S. and Griffin, T. W.","499-505",27,1017,"article","""International Journal of Radiation Oncology, Biology, Physics"""
"id_0001496","Combination therapy with transcatheter arterial chemoembolization and percutaneous ethanol injection compared with percutaneous ethanol injection alone for patients with small hepatocellular carcinoma",2001,"Koda, M. and Murawaki, Y. and Mitsuda, A. and Oyama, K. and Okamoto, K. and Idobe, Y. and Suou, T. and Kawasaki, H.","1516-1524",92,236,"article","Cancer"
"id_0001497","Sonographic evaluation of pleural fluid in a large group of adult healthy individuals--end trial results",2009,"Kocijancic, Ksenija Vidmar and Vidmar, Gaj and Kocijancic, Igor","805-810",33,1730,"article","Collegium Antropologicum"
"id_0001498","Ultrasonographic forms of pleural space in healthy children",2007,"Kocijancic, Ksenija","999-1002",31,1916,"article","Collegium Antropologicum"
"id_0001499","Adaptive/nonadaptive proton radiation planning and outcomes in a phase II trial for locally advanced non-small cell lung cancer",2012,"Koay, E. J. and Lege, D. and Mohan, R. and Komaki, R. and Cox, J. D. and Chang, J. Y.","1093-1100",84,18,"article","International Journal of Radiation Oncology Biology Physics"
"id_0001500","""The efficacy and safety of RAD (lenalidomide, adriamycin and dexamethasone) in newly diagnosed multiple myeloma - First results of a phase II trial by the German DSMM group""",2010,"Knop, S. and Langer, C. and Engelhardt, M. and Muegge, L. O. and Reichle, A. and Rollig, C. and Gramatzki, M. and Roesler, W. and Topp, M. S. and Wesemeier, C. and Hertenstein, B. and Sturm, I. and Dechow, T. and Kortum, M. and Sauerwein, M. and Einsele, H. and Bargou, R.",,116,557,"article","Blood"
"id_0001501","A phase II trial of dasatinib in advanced melanoma",2009,"Kluger, H. M. and Dudek, A. and McCann, C. and Rink, L. and Ritacco, J. and Adrada, C. and Phouyaphone, N. and Southard, N. and Sznol, M.",9010,27,1225,"article","Journal of Clinical Oncology"
"id_0001502","Worldwide surgical experience with the Paracor HeartNet cardiac restraint device",2008,"Klodell, Charles T., Jr. and Aranda, Juan M., Jr. and McGiffin, David C. and Rayburn, Barry K. and Sun, Benjamin and Abraham, William T. and Pae, Walter E., Jr. and Boehmer, John P. and Klein, Helmut and Huth, Christof","188-195",135,1985,"article","Journal of Thoracic & Cardiovascular Surgery"
"id_0001503","Targeting malignant B cells as antigen-presenting cells: TLR-9 agonist induces systemic regression of lymphoma",2011,"Klein-Gonzalez, N. and Holtick, U. and Fairfax, K. and Weihrauch, M. R. and Von Bergwelt-Baildon, M. S.","295-298",10,1803,"article","Expert Review of Vaccines"
"id_0001504","Safety and tolerability of once-daily controlled-release carvedilol 10-80 mg in Japanese patients with chronic heart failure",2012,"Kitakaze, M. and Sarai, N. and Ando, H. and Sakamoto, T. and Nakajima, H.","668-674",76,1696,"article","Circulation Journal"
"id_0001505","Tetracycline and quinacrine in the control of malignant pleural effusion: a randomized clinical trial",1977,"Kisner, D. and Bayly, T. and Sybert, A.","No-C-93",,1806,"article","Procamassoccancer-Res"
"id_0001506","Efficacy of daily bedside chest radiography as visualized by digital luminescence radiography",2001,"Kirchner, J. and Stueckle, C. A. and Schilling, E. M. and Peters, J.","444-447",45,566,"article","Australasian Radiology"
"id_0001507","Surgery: COPPS trial heralds new indication for colchicine",2010,"King, A.",600,7,1776,"article","Nature Reviews Cardiology"
"id_0001508","Various computed tomography findings of 2009 H1N1 influenza in 17 patients with relatively mild illness",2011,"Kim, S. Y. and Kim, J. S. and Park, C. S.","301-306",29,1960,"article","Japanese Journal of Radiology"
"id_0001509","Clinical analysis of emergency liver transplantation: The role of living donor liver transplantation",2012,"Kim, S. J. and Yoon, Y. C. and Yoo, Y. K. and Park, J. H. and Kim, D. G.","833-841",26,176,"article","Clinical Transplantation"
"id_0001510","Tadalafil Administered Once Daily for Treatment of Lower Urinary Tract Symptoms in Korean men with Benign Prostatic Hyperplasia: Results from a Placebo-Controlled Pilot Study Using Tamsulosin as an Ac",2011,"Kim, S. C. and Park, J. K. and Kim, S. W. and Lee, S. W. and Ahn, T. Y. and Kim, J. J. and Paick, J. S. and Park, N. C. and Park, K. and Min, K. S. and Kraus, S. R. and Secrest, R. J. and Elion-Mboussa, A. and Viktrup, L.","86-93",3,1794,"article","LUTS: Lower Urinary Tract Symptoms"
"id_0001511","Outcomes of mediastinoscopy and surgery with or without neoadjuvant therapy in patients with non-small cell lung cancer who are N2 negative on positron emission tomography and computed tomography",2011,"Kim, H. K. and Choi, Y. S. and Kim, K. and Shim, Y. M. and Park, K. and Ahn, Y. C. and Lee, K. S. and Choi, J. Y. and Kim, J.","336-342",6,1078,"article","Journal of Thoracic Oncology"
